"Profile","Question 1","Question 2","Question 3","Question 4","Question 5","Question 6","Question 7","Question 8","Question 9","Question 10"
"Data Analyst","What is the difference between descriptive and inferential statistics?","How do you handle missing values in a dataset?","What is the purpose of data normalization?","What is the concept of correlation?","How do you create a regression model?","What is the difference between a histogram and a bar chart?","How do you calculate the mean and median?","What is the purpose of data visualization?","How do you identify outliers in a dataset?","What is the concept of overfitting in machine learning?"
"Software Developer","What is the difference between monolithic and microservices architecture?","How do you implement inheritance in object-oriented programming?","What is the purpose of a design pattern?","How do you optimize the performance of a software application?","What is the difference between a stack and a queue?","How do you implement recursion in programming?","What is the purpose of a database index?","How do you create a RESTful API?","What is the concept of continuous deployment?","How do you debug a software application?"
"Marketing Specialist","What is the difference between B2B and B2C marketing?","How do you measure the success of a marketing campaign?","What is the purpose of segmentation in marketing?","How do you create a marketing mix?","What is the difference between a lead and a prospect?","How do you conduct market research?","What is the purpose of branding?","How do you create a marketing budget?","What is the concept of account-based marketing?","How do you measure the ROI of a marketing campaign?"
"Mechanical Engineer","What is the difference between static and dynamic loading?","How do you calculate the stress on a material?","What is the purpose of a CAD design?","How do you optimize the performance of a mechanical system?","What is the difference between a gear and a pulley?","How do you implement kinematics in mechanical design?","What is the purpose of a mechanical prototype?","How do you create a mechanical simulation?","What is the concept of thermal expansion?","How do you design a mechanical control system?"
"Biologist","What is the difference between mitosis and meiosis?","How do you explain the concept of natural selection?","What is the purpose of a control group in an experiment?","How do you create a scientific hypothesis?","What is the difference between a plant and animal cell?","How do you conduct a biological experiment?","What is the purpose of a microscope in biology?","How do you identify different species of plants and animals?","What is the concept of gene editing?","How do you explain the concept of evolution?"
"Financial Advisor","What is the difference between a stock and a bond?","How do you calculate the return on investment (ROI)?","What is the purpose of diversification in a portfolio?","How do you create a financial plan?","What is the difference between a mutual fund and an ETF?","How do you implement risk management in finance?","What is the purpose of a financial statement?","How do you create a budget?","What is the concept of compound interest?","How do you explain the concept of inflation?"
"Human Resources Manager","What is the difference between recruitment and selection?","How do you handle employee grievances?","What is the purpose of performance appraisals?","How do you create a compensation plan?","What is the difference between training and development?","How do you implement an employee engagement strategy?","What is the purpose of an exit interview?","How do you handle workplace diversity?","What is the concept of talent management?","How do you ensure compliance with labor laws?"
"Graphic Designer","What is the difference between vector and raster graphics?","How do you choose a color scheme for a design?","What is the purpose of typography in design?","How do you create a brand identity?","What is the difference between a logo and a brand?","How do you implement responsive design?","What is the purpose of a design brief?","How do you create a wireframe for a website?","What is the concept of user experience (UX) design?","How do you use Adobe Photoshop for graphic design?"
"Project Manager","What is the difference between a project and a program?","How do you create a project plan?","What is the purpose of a Gantt chart?","How do you manage project risks?","What is the difference between Agile and Waterfall methodologies?","How do you implement project scope management?","What is the purpose of a project kickoff meeting?","How do you handle project changes?","What is the concept of stakeholder management?","How do you measure project success?"
"Network Engineer","What is the difference between LAN and WAN?","How do you configure a router?","What is the purpose of a firewall in network security?","How do you create a network topology?","What is the difference between IPv4 and IPv6?","How do you implement network redundancy?","What is the purpose of a VLAN?","How do you troubleshoot network connectivity issues?","What is the concept of network segmentation?","How do you secure a wireless network?"
"UX Designer","What is the difference between UI and UX?","How do you conduct user research?","What is the purpose of a user persona?","How do you create a user journey map?","What is the difference between low-fidelity and high-fidelity prototypes?","How do you implement usability testing?","What is the purpose of an information architecture?","How do you create a wireframe?","What is the concept of user-centered design?","How do you use Figma for UI/UX design?"
"Sales Manager","What is the difference between inside sales and outside sales?","How do you create a sales strategy?","What is the purpose of a sales funnel?","How do you measure sales performance?","What is the difference between upselling and cross-selling?","How do you implement customer relationship management (CRM)?","What is the purpose of a sales pitch?","How do you handle customer objections?","What is the concept of value-based selling?","How do you create a sales forecast?"
"Environmental Scientist","What is the difference between renewable and non-renewable resources?","How do you conduct an environmental impact assessment?","What is the purpose of sustainability in environmental science?","How do you create a conservation plan?","What is the difference between climate change and global warming?","How do you implement environmental monitoring?","What is the purpose of a biodiversity assessment?","How do you measure carbon footprint?","What is the concept of ecosystem services?","How do you explain the importance of environmental ethics?"
"Product Manager","What is the difference between a product and a service?","How do you create a product roadmap?","What is the purpose of a product launch?","How do you manage a product lifecycle?","What is the difference between a minimum viable product (MVP) and a prototype?","How do you implement product-market fit?","What is the purpose of a product backlog?","How do you handle product feedback?","What is the concept of product differentiation?","How do you measure product success?"
"Cybersecurity Analyst","What is the difference between a virus and a worm?","How do you conduct a vulnerability assessment?","What is the purpose of encryption in cybersecurity?","How do you create a cybersecurity incident response plan?","What is the difference between a firewall and an antivirus?","How do you implement multi-factor authentication (MFA)?","What is the purpose of a cybersecurity policy?","How do you secure cloud-based systems?","What is the concept of penetration testing?","How do you explain the importance of cybersecurity awareness?"
"Teacher","What is the difference between formative and summative assessment?","How do you create a lesson plan?","What is the purpose of differentiated instruction?","How do you manage classroom behavior?","What is the difference between pedagogy and andragogy?","How do you implement inclusive education?","What is the purpose of educational technology?","How do you assess student learning?","What is the concept of student-centered learning?","How do you support students with learning disabilities?"
"Event Planner","What is the difference between a wedding planner and an event planner?","How do you create an event budget?","What is the purpose of event logistics?","How do you manage event vendors?","What is the difference between an RSVP and a save-the-date?","How do you implement event marketing?","What is the purpose of a venue walkthrough?","How do you handle event emergencies?","What is the concept of event branding?","How do you measure event success?"
"Architect","What is the difference between an architect and a civil engineer?","How do you create an architectural blueprint?","What is the purpose of sustainable architecture?","How do you optimize building design for energy efficiency?","What is the difference between modern and contemporary architecture?","How do you implement building codes and regulations?","What is the purpose of architectural visualization?","How do you create a site plan?","What is the concept of smart buildings?","How do you ensure structural integrity in architectural design?"
"Chef","What is the difference between baking and roasting?","How do you create a menu for a restaurant?","What is the purpose of food presentation?","How do you optimize kitchen workflow?","What is the difference between a chef and a cook?","How do you implement food safety practices?","What is the purpose of a food tasting?","How do you create a recipe?","What is the concept of farm-to-table dining?","How do you manage food costs in a restaurant?"
"Pharmacist","What is the difference between a generic and a brand-name drug?","How do you calculate drug dosages?","What is the purpose of a prescription?","How do you counsel patients on medication use?","What is the difference between over-the-counter and prescription medications?","How do you implement medication adherence strategies?","What is the purpose of a drug interaction check?","How do you handle controlled substances?","What is the concept of pharmaceutical compounding?","How do you ensure patient safety in pharmacy practice?"
"Nurse","What is the difference between an RN and an LPN?","How do you create a patient care plan?","What is the purpose of patient education?","How do you manage patient pain?","What is the difference between acute and chronic conditions?","How do you implement infection control practices?","What is the purpose of a patient assessment?","How do you administer medication safely?","What is the concept of holistic nursing care?","How do you support patients' mental health?"
"Legal Consultant","What is the difference between civil and criminal law?","How do you draft a legal contract?","What is the purpose of legal due diligence?","How do you handle client confidentiality?","What is the difference between a plaintiff and a defendant?","How do you implement legal research strategies?","What is the purpose of a legal memorandum?","How do you prepare for a court case?","What is the concept of alternative dispute resolution (ADR)?","How do you explain the importance of legal ethics?"
"Data Scientist","What is the difference between supervised and unsupervised learning?","How do you handle unstructured data?","What is the purpose of feature engineering?","How do you create a machine learning model?","What is the difference between deep learning and traditional machine learning?","How do you implement cross-validation in model training?","What is the purpose of a confusion matrix?","How do you handle imbalanced datasets?","What is the concept of model interpretability?","How do you explain the importance of data ethics?"
"Accountant","What is the difference between cash and accrual accounting?","How do you prepare a balance sheet?","What is the purpose of a financial audit?","How do you manage accounts receivable?","What is the difference between a debit and a credit?","How do you implement tax planning strategies?","What is the purpose of a general ledger?","How do you create a cash flow statement?","What is the concept of double-entry bookkeeping?","How do you explain the importance of financial compliance?"
"Mechanical Technician","What is the difference between preventive and corrective maintenance?","How do you troubleshoot mechanical equipment?","What is the purpose of a maintenance schedule?","How do you optimize equipment performance?","What is the difference between hydraulic and pneumatic systems?","How do you implement machine safety protocols?","What is the purpose of lubrication in machinery?","How do you conduct a mechanical inspection?","What is the concept of predictive maintenance?","How do you handle equipment breakdowns?"
"Journalist","What is the difference between an editorial and a news article?","How do you conduct an interview?","What is the purpose of investigative journalism?","How do you write a compelling lead?","What is the difference between fact-checking and proofreading?","How do you implement journalistic ethics?","What is the purpose of a press release?","How do you create a news report?","What is the concept of media bias?","How do you explain the importance of freedom of the press?"
"Psychologist","What is the difference between clinical and counseling psychology?","How do you conduct a psychological assessment?","What is the purpose of cognitive behavioral therapy (CBT)?","How do you support patients with anxiety?","What is the difference between a psychologist and a psychiatrist?","How do you implement treatment plans for mental health?","What is the purpose of psychological research?","How do you conduct a therapy session?","What is the concept of resilience in psychology?","How do you explain the importance of mental health awareness?"
"Physicist","What is the difference between classical and quantum mechanics?","How do you calculate the velocity of an object?","What is the purpose of a particle accelerator?","How do you explain the concept of relativity?","What is the difference between energy and power?","How do you implement the laws of thermodynamics in experiments?","What is the purpose of a wave function?","How do you calculate the force on an object?","What is the concept of dark matter?","How do you explain the significance of the Higgs boson?"
"Chemist","What is the difference between an element and a compound?","How do you balance a chemical equation?","What is the purpose of a titration?","How do you identify chemical reactions?","What is the difference between an acid and a base?","How do you implement chromatography in analysis?","What is the purpose of a catalyst in a reaction?","How do you calculate molar mass?","What is the concept of chemical equilibrium?","How do you explain the significance of the periodic table?"
"Architectural Engineer","What is the difference between structural and architectural design?","How do you calculate load-bearing capacity?","What is the purpose of seismic design?","How do you optimize building materials for sustainability?","What is the difference between load-bearing walls and frames?","How do you implement building information modeling (BIM)?","What is the purpose of HVAC systems in buildings?","How do you create an energy-efficient building design?","What is the concept of passive solar design?","How do you ensure compliance with building codes?"
"Sociologist","What is the difference between qualitative and quantitative research?","How do you conduct a social survey?","What is the purpose of ethnography in sociology?","How do you analyze social structures?","What is the difference between a society and a community?","How do you implement sociological theories in research?","What is the purpose of studying social stratification?","How do you identify cultural norms and values?","What is the concept of socialization?","How do you explain the impact of globalization on societies?"
"Entrepreneur","What is the difference between a startup and a small business?","How do you create a business plan?","What is the purpose of market validation?","How do you raise capital for a new venture?","What is the difference between equity and debt financing?","How do you implement a go-to-market strategy?","What is the purpose of a value proposition?","How do you handle business scaling challenges?","What is the concept of customer acquisition cost?","How do you measure business success?"
"Economist","What is the difference between microeconomics and macroeconomics?","How do you analyze economic indicators?","What is the purpose of fiscal policy?","How do you explain the concept of supply and demand?","What is the difference between inflation and deflation?","How do you implement economic models in analysis?","What is the purpose of monetary policy?","How do you calculate gross domestic product (GDP)?","What is the concept of market equilibrium?","How do you explain the impact of globalization on economies?"
"Veterinarian","What is the difference between a dog and a cat's anatomy?","How do you diagnose common animal diseases?","What is the purpose of vaccinations in pets?","How do you conduct a physical exam on animals?","What is the difference between zoonotic and non-zoonotic diseases?","How do you implement animal welfare practices?","What is the purpose of spaying and neutering?","How do you handle emergency cases in veterinary practice?","What is the concept of animal behavior?","How do you explain the importance of pet nutrition?"
"Photographer","What is the difference between a DSLR and a mirrorless camera?","How do you adjust the aperture and shutter speed?","What is the purpose of the rule of thirds in photography?","How do you create a depth of field in a photo?","What is the difference between natural and artificial lighting?","How do you implement post-processing techniques?","What is the purpose of a photography portfolio?","How do you capture motion in photography?","What is the concept of photojournalism?","How do you explain the significance of composition in photography?"
"HR Specialist","What is the difference between job analysis and job evaluation?","How do you conduct a job interview?","What is the purpose of employee onboarding?","How do you create a performance management system?","What is the difference between compensation and benefits?","How do you implement training and development programs?","What is the purpose of a succession plan?","How do you handle employee relations?","What is the concept of organizational culture?","How do you ensure compliance with employment laws?"
"Urban Planner","What is the difference between urban and rural planning?","How do you conduct a land use survey?","What is the purpose of zoning in urban planning?","How do you create a transportation plan for a city?","What is the difference between public and private spaces?","How do you implement sustainable urban development practices?","What is the purpose of urban renewal projects?","How do you address housing challenges in urban areas?","What is the concept of smart cities?","How do you ensure community involvement in urban planning?"
"Actuary","What is the difference between risk assessment and risk management?","How do you calculate life expectancy?","What is the purpose of actuarial models?","How do you analyze insurance premiums?","What is the difference between probability and statistics?","How do you implement stochastic modeling in actuarial science?","What is the purpose of an actuarial reserve?","How do you evaluate pension plans?","What is the concept of reinsurance?","How do you explain the significance of mortality tables?"
"Air Traffic Controller","What is the difference between radar and non-radar separation?","How do you ensure the safety of aircraft during takeoff?","What is the purpose of air traffic control communication?","How do you handle emergency situations in air traffic control?","What is the difference between visual and instrument flight rules?","How do you implement air traffic control procedures?","What is the purpose of a flight plan?","How do you coordinate with pilots and other controllers?","What is the concept of airspace management?","How do you explain the importance of situational awareness in air traffic control?"
"Logistician","What is the difference between inbound and outbound logistics?","How do you optimize supply chain efficiency?","What is the purpose of inventory management?","How do you handle transportation and distribution?","What is the difference between just-in-time and just-in-case inventory strategies?","How do you implement logistics software solutions?","What is the purpose of warehouse management?","How do you manage logistics for international shipping?","What is the concept of reverse logistics?","How do you explain the importance of logistics in global trade?"
"Public Relations Specialist","What is the difference between public relations and advertising?","How do you manage a public relations crisis?","What is the purpose of a press release?","How do you build relationships with the media?","What is the difference between earned and paid media?","How do you implement a PR campaign?","What is the purpose of a media kit?","How do you handle negative publicity?","What is the concept of brand reputation management?","How do you measure the success of a PR campaign?"
"AI Researcher","What is the difference between artificial intelligence and machine learning?","How do you train a neural network?","What is the purpose of reinforcement learning?","How do you explain the concept of natural language processing?","What is the difference between supervised and unsupervised learning?","How do you implement deep learning models?","What is the purpose of AI ethics?","How do you handle large datasets in AI research?","What is the concept of transfer learning?","How do you explain the importance of explainable AI?"
"Operations Manager","What is the difference between operations and production management?","How do you optimize operational efficiency?","What is the purpose of process improvement?","How do you manage operational risks?","What is the difference between lean manufacturing and Six Sigma?","How do you implement quality control in operations?","What is the purpose of supply chain management?","How do you handle operational challenges in a crisis?","What is the concept of continuous improvement?","How do you measure operational success?"
"Web Developer","What is the difference between front-end and back-end development?","How do you create a responsive website design?","What is the purpose of a content management system (CMS)?","How do you optimize a website for search engines?","What is the difference between a static and dynamic website?","How do you implement web security practices?","What is the purpose of a web server?","How do you handle website performance optimization?","What is the concept of cross-browser compatibility?","How do you explain the importance of user experience in web development?"
"Speech Therapist","What is the difference between speech and language disorders?","How do you assess a speech disorder?","What is the purpose of speech therapy?","How do you create a speech therapy plan?","What is the difference between articulation and phonological disorders?","How do you implement communication strategies for non-verbal individuals?","What is the purpose of language intervention?","How do you support individuals with stuttering?","What is the concept of augmentative and alternative communication (AAC)?","How do you explain the importance of early intervention in speech therapy?"
"Statistician","What is the difference between descriptive and inferential statistics?","How do you conduct hypothesis testing?","What is the purpose of regression analysis?","How do you calculate the mean, median, and mode?","What is the difference between a sample and a population?","How do you implement statistical software for data analysis?","What is the purpose of a confidence interval?","How do you handle outliers in a dataset?","What is the concept of statistical significance?","How do you explain the importance of data integrity in statistical analysis?"
"Security Analyst","What is the difference between cybersecurity and information security?","How do you conduct a security risk assessment?","What is the purpose of a firewall?","How do you implement encryption protocols?","What is the difference between malware and ransomware?","How do you handle a security breach?","What is the purpose of an intrusion detection system (IDS)?","How do you manage access controls?","What is the concept of zero trust security?","How do you explain the importance of cybersecurity awareness?"
"Product Manager","What is the difference between a product and a feature?","How do you prioritize product features?","What is the purpose of a product roadmap?","How do you conduct user research for a product?","What is the difference between a product manager and a project manager?","How do you implement a product launch?","What is the purpose of a minimum viable product (MVP)?","How do you handle product lifecycle management?","What is the concept of product-market fit?","How do you measure product success?"
"Graphic Designer","What is the difference between vector and raster graphics?","How do you create a brand identity?","What is the purpose of typography in design?","How do you implement color theory in design?","What is the difference between UX and UI design?","How do you create a design portfolio?","What is the purpose of wireframing in design?","How do you handle client feedback in design projects?","What is the concept of visual hierarchy?","How do you explain the importance of accessibility in design?"
