"Profile","Question 1","Question 2","Question 3","Question 4","Question 5","Question 6","Question 7","Question 8","Question 9","Question 10"
"Supply Chain Manager","What is the difference between supply chain and logistics?","How do you optimize supply chain efficiency?","What is the purpose of demand forecasting?","How do you manage supplier relationships?","What is the difference between inbound and outbound logistics?","How do you implement inventory management strategies?","What is the purpose of supply chain analytics?","How do you handle supply chain disruptions?","What is the concept of just-in-time inventory?","How do you measure supply chain performance?"
"Customer Service Representative","What is the difference between customer service and customer support?","How do you handle difficult customers?","What is the purpose of a customer service script?","How do you improve customer satisfaction?","What is the difference between empathy and sympathy in customer service?","How do you implement a customer feedback loop?","What is the purpose of a customer relationship management (CRM) system?","How do you handle multiple customer queries simultaneously?","What is the concept of customer retention?","How do you explain the importance of active listening in customer service?"
"Environmental Scientist","What is the difference between renewable and non-renewable resources?","How do you conduct an environmental impact assessment?","What is the purpose of sustainable development?","How do you manage waste and recycling programs?","What is the difference between climate change and global warming?","How do you implement conservation strategies?","What is the purpose of environmental regulations?","How do you monitor air and water quality?","What is the concept of biodiversity?","How do you explain the significance of ecosystems?"
"Content Writer","What is the difference between content writing and copywriting?","How do you conduct keyword research for SEO?","What is the purpose of a content calendar?","How do you write engaging content for different audiences?","What is the difference between a blog post and an article?","How do you implement storytelling in content writing?","What is the purpose of a call to action (CTA) in content?","How do you handle writer's block?","What is the concept of content repurposing?","How do you measure the effectiveness of content?"
"Event Planner","What is the difference between corporate and social events?","How do you create an event budget?","What is the purpose of event logistics?","How do you manage vendor relationships for events?","What is the difference between an event agenda and a program?","How do you implement event marketing strategies?","What is the purpose of an event timeline?","How do you handle last-minute changes in event planning?","What is the concept of event branding?","How do you measure event success?"
"Data Scientist","What is the difference between structured and unstructured data?","How do you clean and preprocess data?","What is the purpose of data modeling?","How do you implement machine learning algorithms?","What is the difference between supervised and unsupervised learning?","How do you handle big data?","What is the purpose of data visualization?","How do you manage data privacy and security?","What is the concept of feature engineering?","How do you explain the importance of data-driven decision making?"
"UX Designer","What is the difference between UX and UI design?","How do you conduct user research?","What is the purpose of creating user personas?","How do you design wireframes and prototypes?","What is the difference between low-fidelity and high-fidelity prototypes?","How do you implement usability testing?","What is the purpose of user journey mapping?","How do you handle design iterations based on user feedback?","What is the concept of information architecture?","How do you explain the importance of accessibility in UX design?"
"Legal Advisor","What is the difference between civil and criminal law?","How do you conduct legal research?","What is the purpose of a contract?","How do you draft legal documents?","What is the difference between mediation and arbitration?","How do you implement risk management in legal practice?","What is the purpose of intellectual property rights?","How do you handle client confidentiality?","What is the concept of due diligence?","How do you explain the importance of legal compliance?"
"Cybersecurity Specialist","What is the difference between a virus and a worm?","How do you protect a network from cyber threats?","What is the purpose of encryption in cybersecurity?","How do you implement multi-factor authentication?","What is the difference between a firewall and an intrusion detection system (IDS)?","How do you handle a cybersecurity incident?","What is the purpose of cybersecurity awareness training?","How do you conduct vulnerability assessments?","What is the concept of zero-day exploits?","How do you explain the importance of data encryption?"
"Data Engineer","What is the difference between ETL and ELT?","How do you design a data pipeline?","What is the purpose of data warehousing?","How do you implement data partitioning?","What is the difference between batch processing and stream processing?","How do you optimize database performance?","What is the purpose of data governance?","How do you manage data lakes?","What is the concept of data lineage?","How do you explain the importance of data quality in engineering?"
"Network Administrator","What is the difference between LAN and WAN?","How do you configure a network router?","What is the purpose of network segmentation?","How do you implement network security protocols?","What is the difference between IPv4 and IPv6?","How do you handle network troubleshooting?","What is the purpose of a virtual private network (VPN)?","How do you monitor network performance?","What is the concept of load balancing in networks?","How do you explain the importance of network redundancy?"
"Social Media Manager","What is the difference between organic and paid social media?","How do you create a social media content calendar?","What is the purpose of social media analytics?","How do you manage social media communities?","What is the difference between engagement and reach?","How do you implement social media advertising?","What is the purpose of influencer marketing?","How do you handle social media crises?","What is the concept of social listening?","How do you explain the importance of brand consistency on social media?"
"Digital Marketing Specialist","What is the difference between SEO and SEM?","How do you create a digital marketing strategy?","What is the purpose of content marketing?","How do you implement email marketing campaigns?","What is the difference between PPC and organic search?","How do you measure digital marketing ROI?","What is the purpose of A/B testing in digital marketing?","How do you manage a digital advertising budget?","What is the concept of conversion rate optimization?","How do you explain the importance of customer segmentation in digital marketing?"
"Clinical Psychologist","What is the difference between cognitive-behavioral therapy (CBT) and psychodynamic therapy?","How do you conduct a psychological assessment?","What is the purpose of a treatment plan?","How do you manage patient confidentiality?","What is the difference between anxiety and depression?","How do you implement therapeutic interventions?","What is the purpose of psychological testing?","How do you handle resistance in therapy?","What is the concept of transference in therapy?","How do you explain the importance of therapeutic rapport?"
"Machine Learning Engineer","What is the difference between a classifier and a regressor?","How do you train a machine learning model?","What is the purpose of feature selection?","How do you evaluate a machine learning model?","What is the difference between overfitting and underfitting?","How do you implement cross-validation?","What is the purpose of hyperparameter tuning?","How do you handle imbalanced datasets?","What is the concept of ensemble learning?","How do you explain the importance of model interpretability?"
"HR Manager","What is the difference between recruitment and talent acquisition?","How do you create an employee retention strategy?","What is the purpose of performance appraisals?","How do you manage employee relations?","What is the difference between leadership and management?","How do you implement employee training programs?","What is the purpose of succession planning?","How do you handle workplace conflicts?","What is the concept of employee engagement?","How do you explain the importance of diversity and inclusion in the workplace?"
"Database Administrator","What is the difference between a relational and a non-relational database?","How do you optimize database queries?","What is the purpose of database indexing?","How do you implement database backups and recovery?","What is the difference between a primary key and a foreign key?","How do you handle database security?","What is the purpose of normalization in database design?","How do you monitor database performance?","What is the concept of ACID properties in databases?","How do you explain the importance of data integrity in database management?"
"Project Manager","What is the difference between a project and a program?","How do you create a project schedule?","What is the purpose of a project charter?","How do you manage project risks?","What is the difference between a milestone and a deliverable?","How do you implement project management software?","What is the purpose of a work breakdown structure (WBS)?","How do you handle project scope changes?","What is the concept of stakeholder management?","How do you explain the importance of communication in project management?"
"Nutritionist","What is the difference between macronutrients and micronutrients?","How do you create a personalized meal plan?","What is the purpose of dietary supplements?","How do you manage dietary restrictions for clients?","What is the difference between a dietitian and a nutritionist?","How do you implement nutrition education programs?","What is the purpose of a food diary?","How do you handle food allergies in meal planning?","What is the concept of mindful eating?","How do you explain the importance of balanced nutrition?"
"Operations Manager","What is the difference between operations management and supply chain management?","How do you optimize operational efficiency?","What is the purpose of process improvement?","How do you manage operational risks?","What is the difference between lean and six sigma methodologies?","How do you implement quality control measures?","What is the purpose of resource allocation?","How do you handle operational bottlenecks?","What is the concept of capacity planning?","How do you explain the importance of continuous improvement in operations?"
"Public Relations Specialist","What is the difference between public relations and advertising?","How do you create a PR strategy?","What is the purpose of media relations?","How do you manage a public relations crisis?","What is the difference between earned media and paid media?","How do you implement a press release?","What is the purpose of a media kit?","How do you handle negative publicity?","What is the concept of brand reputation management?","How do you explain the importance of transparency in public relations?"
"Systems Analyst","What is the difference between systems analysis and systems design?","How do you conduct a feasibility study?","What is the purpose of requirements gathering?","How do you create a system architecture diagram?","What is the difference between functional and non-functional requirements?","How do you implement systems integration?","What is the purpose of a use case diagram?","How do you handle system testing and validation?","What is the concept of scalability in system design?","How do you explain the importance of system documentation?"
"Research Scientist","What is the difference between qualitative and quantitative research?","How do you conduct a literature review?","What is the purpose of a research hypothesis?","How do you design an experimental study?","What is the difference between a dependent and an independent variable?","How do you implement data analysis in research?","What is the purpose of a research proposal?","How do you handle ethical considerations in research?","What is the concept of peer review?","How do you explain the importance of reproducibility in research?"
"IT Support Specialist","What is the difference between a help desk and IT support?","How do you troubleshoot hardware issues?","What is the purpose of remote desktop support?","How do you manage software installations and updates?","What is the difference between a virus and a Trojan?","How do you implement data backup and recovery?","What is the purpose of network troubleshooting?","How do you handle IT support tickets?","What is the concept of IT asset management?","How do you explain the importance of customer service in IT support?"
"Chemical Engineer","What is the difference between a chemical reaction and a physical reaction?","How do you design a chemical process?","What is the purpose of process optimization in chemical engineering?","How do you manage chemical safety protocols?","What is the difference between a batch process and a continuous process?","How do you implement scale-up procedures in chemical engineering?","What is the purpose of a chemical reactor?","How do you handle waste management in chemical processes?","What is the concept of mass and energy balance?","How do you explain the importance of environmental sustainability in chemical engineering?"
"Operations Research Analyst","What is the difference between linear programming and dynamic programming?","How do you conduct operations research?","What is the purpose of optimization in operations research?","How do you implement simulation models?","What is the difference between deterministic and stochastic models?","How do you handle decision analysis in operations research?","What is the purpose of sensitivity analysis?","How do you create a decision tree?","What is the concept of game theory?","How do you explain the importance of quantitative analysis in decision making?"
"Biomedical Engineer","What is the difference between biomedical engineering and bioengineering?","How do you design medical devices?","What is the purpose of biomedical imaging?","How do you manage biocompatibility testing?","What is the difference between a prosthetic and an orthotic device?","How do you implement tissue engineering techniques?","What is the purpose of a clinical trial in biomedical engineering?","How do you handle regulatory compliance in medical device development?","What is the concept of personalized medicine?","How do you explain the importance of innovation in biomedical engineering?"
"Actuary","What is the difference between an actuary and a statistician?","How do you conduct actuarial analysis?","What is the purpose of risk assessment in actuarial science?","How do you implement actuarial models?","What is the difference between life insurance and annuities?","How do you calculate insurance premiums?","What is the purpose of actuarial tables?","How do you handle pension fund management?","What is the concept of mortality and morbidity in actuarial science?","How do you explain the importance of actuarial assumptions in risk management?"
"Cloud Architect","What is the difference between IaaS, PaaS, and SaaS?","How do you design a cloud architecture?","What is the purpose of cloud migration?","How do you implement cloud security best practices?","What is the difference between public cloud and private cloud?","How do you manage cloud cost optimization?","What is the purpose of a hybrid cloud strategy?","How do you handle cloud compliance requirements?","What is the concept of cloud elasticity?","How do you explain the importance of cloud disaster recovery planning?"
"Electrical Engineer","What is the difference between AC and DC current?","How do you design an electrical circuit?","What is the purpose of power factor correction?","How do you manage electrical safety protocols?","What is the difference between a transformer and an inductor?","How do you implement renewable energy systems?","What is the purpose of an electrical schematic?","How do you handle electromagnetic interference (EMI) in circuit design?","What is the concept of voltage regulation?","How do you explain the importance of energy efficiency in electrical engineering?"
"Game Developer","What is the difference between a game engine and a game framework?","How do you design game mechanics?","What is the purpose of a game design document?","How do you implement physics in game development?","What is the difference between 2D and 3D game development?","How do you handle game optimization?","What is the purpose of playtesting in game development?","How do you create game assets?","What is the concept of procedural generation in games?","How do you explain the importance of user experience in game design?"
"Logistics Manager","What is the difference between inbound and outbound logistics?","How do you optimize logistics operations?","What is the purpose of warehouse management?","How do you manage transportation logistics?","What is the difference between third-party logistics (3PL) and fourth-party logistics (4PL)?","How do you implement logistics software solutions?","What is the purpose of inventory control in logistics?","How do you handle logistics risk management?","What is the concept of last-mile delivery?","How do you explain the importance of logistics in supply chain management?"
"SEO Specialist","What is the difference between on-page and off-page SEO?","How do you conduct keyword research for SEO?","What is the purpose of meta tags in SEO?","How do you optimize website speed for SEO?","What is the difference between a backlink and a referring domain?","How do you implement local SEO strategies?","What is the purpose of SEO analytics?","How do you handle SEO for e-commerce websites?","What is the concept of search engine algorithms?","How do you explain the importance of content in SEO?"
"Quality Assurance Analyst","What is the difference between manual testing and automated testing?","How do you create a test plan?","What is the purpose of regression testing?","How do you manage test case execution?","What is the difference between functional and non-functional testing?","How do you implement test automation frameworks?","What is the purpose of defect tracking?","How do you handle test environment setup?","What is the concept of user acceptance testing (UAT)?","How do you explain the importance of quality assurance in software development?"
"Teacher","What is the difference between formative and summative assessment?","How do you create a lesson plan?","What is the purpose of differentiated instruction?","How do you manage classroom behavior?","What is the difference between a syllabus and a curriculum?","How do you implement project-based learning?","What is the purpose of parent-teacher communication?","How do you handle students with learning disabilities?","What is the concept of student engagement?","How do you explain the importance of professional development for teachers?"
"Architect","What is the difference between modern and contemporary architecture?","How do you create architectural blueprints?","What is the purpose of sustainable
